seeker_survey_id	role	seeker_id	case	reason	age_group	gender	race	degree	job	marital_status	political_view	religion	recommender_id	date
first_batch_471	SEEKER	user_700	accept_rating_good	It is a perfect match for what I was looking for!	45 - 54	Female	South Asian	Bachelor/4-year Degree	Employed	Married	Liberal	Other	user_699	2019-12-08 17:35:12.946531
first_batch_472	SEEKER	user_702	accept_rating_good	You Were Never Really Here	25 - 34	Male	Hispanic/Latino	Associate Degree	Employed	Never been married	Liberal	Atheist	user_701	2019-12-08 17:39:39.379145
first_batch_473	SEEKER	user_704	accept_rating_good	I enjoyed watching it because the person i was chatting with recommended it	18 - 24	Female	Caucasian	High School/GED	University Student	Never been married	Moderate	Atheist	user_703	2019-12-08 18:21:04.119535
first_batch_474	SEEKER	user_96	accept_uninterested	romantic and funny	18 - 24	Female	Caucasian	Bachelor/4-year Degree	Employed	Never been married	Conservative	Protestant	user_705	2019-12-08 18:31:39.440872
first_batch_475	SEEKER	user_85	accept_others	he recommendated according to my favourite gener	35 - 44	Female	South Asian	Bachelor/4-year Degree	Employed	Married	Moderate	Hindu	user_706	2019-12-08 19:29:46.469316
first_batch_476	SEEKER	user_708	accept_others	they knew movies with an actor I like	18 - 24	Female	Caucasian	Bachelor/4-year Degree	Non-university student	Never been married	Moderate	Protestant	user_707	2019-12-08 19:54:46.650133
first_batch_477	SEEKER	user_677	accept_others	it is comedy 	25 - 34	Male	Caucasian	Bachelor/4-year Degree	Employed	Never been married	Conservative	Roman Catholic	user_709	2019-12-09 00:52:40.475791
first_batch_478	SEEKER	user_711	accept_rating_good	Seemed sincere	25 - 34	Male	Caucasian	Bachelor/4-year Degree	Employed	Living with partner	Liberal	Atheist	user_710	2019-12-09 05:57:12.405951
first_batch_479	SEEKER	user_712	accept_uninterested	The reality of the movie without the portayal of superhumans or superhuman abilties 	18 - 24	Male	Caucasian	High School/GED	Employed	Never been married	Moderate	Atheist	user_372	2019-12-09 06:03:35.509809
first_batch_480	SEEKER	user_714	accept_rating_good	That the video seems similar to a book series that we read as children. It appears to be scary with a good plot.	25 - 34	Female	Caucasian	Associate Degree	Homemaker	Married	Conservative	Roman Catholic	user_713	2019-12-09 06:32:23.990107
first_batch_481	SEEKER	user_199	accept_others	I love Star Wars and have been waiting for this movie for 2 years, especially because I really did not like 'The Last Jedi'.	25 - 34	Male	East Asian	Master	Employed	Married	Liberal	Atheist	user_715	2019-12-09 07:30:56.796996
first_batch_482	SEEKER	user_717	accept_rating_good	the recommenders thought and  approval of similar movies	25 - 34	Male	Caucasian	Master	Employed	Married	Moderate	Jewish	user_716	2019-12-09 07:37:46.218187
first_batch_483	SEEKER	user_719	accept_others	I would not accept the recommended video, I don't like the lead actress and I don't like historical dramas that take a lot of license with the material in order for the director to make interesting visuals.	35 - 44	Female	Caucasian	No Degree	Employed	Living with partner	Liberal	Other	user_718	2019-12-09 07:46:37.660294
first_batch_484	SEEKER	user_121	accept_rating_good	The description provided by the recommender, along with my previous knowledge of the book and film (which I have not read nor seen yet)	45 - 54	Female	Caucasian	High School/GED	Employed	Separated	Liberal	Other	user_720	2019-12-09 08:01:03.912278
first_batch_485	SEEKER	user_721	accept_others	The trailer appeals to me, and I think I'll put this movie on my watch list.	25 - 34	Male	Caucasian	Bachelor/4-year Degree	Employed	Married	Conservative	Protestant	user_420	2019-12-09 08:10:42.511785
first_batch_486	SEEKER	user_723	accept_others	Interested in movie	25 - 34	Male	Caucasian	Bachelor/4-year Degree	Employed	Married	Moderate	Protestant	user_722	2019-12-09 08:20:26.536089
first_batch_487	SEEKER	user_725	accept_rating_good	I really enjoy Christmas horror movies.	45 - 54	Male	Caucasian	High School/GED	Employed	Never been married	Moderate	Other	user_724	2019-12-09 11:25:14.895788
first_batch_488	SEEKER	user_650	reject		45 - 54	Male	Native American/American Indian/Alaskan Native	Master	Employed	Married	Conservative	Roman Catholic	user_726	2019-12-09 11:44:12.232494
first_batch_489	SEEKER	user_98	accept_rating_good	The recommender carefully considered my taste in films	25 - 34	Female	Caucasian	Bachelor/4-year Degree	Employed	Married	Liberal	Other	user_727	2019-12-09 11:45:59.299562
first_batch_490	SEEKER	user_729	accept_uninterested	I love horror movies, I watched the original movie, and I've heard some good things about the sequel. 	25 - 34	Female	Other	Bachelor/4-year Degree	Employed	Never been married	Liberal	Atheist	user_728	2019-12-09 11:57:59.355953
first_batch_492	SEEKER	user_731	accept_rating_good	I love watching horror movies	35 - 44	Female	Southeast Asian	Master	Employed	Married	Liberal	Hindu	user_730	2019-12-09 12:36:11.125533
first_batch_491	SEEKER	user_733	accept_uninterested	The recommender was very detailed on the story plot and the action in the movie. The recommeder was able to recommend a movie that fits my demographic that I was looking for and gave great information about the actors in the movie.	35 - 44	Female	African	Bachelor/4-year Degree	University Student	Married	Moderate	Other	user_732	2019-12-09 12:35:42.201539
first_batch_494	SEEKER	user_735	accept_others	It is an action movie and I enjoy action.	25 - 34	Female	Caucasian	High School/GED	Employed	Living with partner	Moderate	Buddhist	user_734	2019-12-09 12:55:35.640801
first_batch_493	SEEKER	user_737	accept_uninterested	The recommendation	25 - 34	Male	Caucasian	Bachelor/4-year Degree	Employed	Never been married	Moderate	Atheist	user_736	2019-12-09 12:54:24.547361
first_batch_495	SEEKER	user_739	accept_rating_good	It looks pretty funny and has an all star cast, plus its old school:)	35 - 44	Female	Caucasian	Bachelor/4-year Degree	Employed	Married	Liberal	Other	user_738	2019-12-09 13:08:01.010775
first_batch_496	SEEKER	user_508	accept_rating_good	I actually am curious about the show.	55 - 74	Female	Caucasian	Associate Degree	Employed	Married	Moderate	Other	user_104	2019-12-09 13:27:59.281815
first_batch_519	SEEKER	user_740	accept_others	seeing the joker as a boy and why he ends up being the way he is 	45 - 54	Female	Caucasian	Bachelor/4-year Degree	Employed	Divorced	Moderate	Jewish	user_78	2019-11-30 14:41:23.233490
first_batch_520	SEEKER	user_741	accept_rating_good	I like the actors. Looks like a feel good movie, easy to watch on a plane.	35 - 44	Female	Hispanic/Latino	Doctorate	Employed	Married	Liberal	Atheist	user_478	2019-11-30 14:48:13.865190
first_batch_521	SEEKER	user_743	accept_rating_mod	Lisa Kudrow was mentioned, and the 97% approval rating of rotten tomatoes gives me hope this is a good enough money.	25 - 34	Female	East Asian	Bachelor/4-year Degree	Employed	Married	Liberal	Atheist	user_742	2019-11-30 14:54:00.298144
first_batch_522	SEEKER	user_12	accept_others	Very colorful visual film	35 - 44	Male	Caucasian	Bachelor/4-year Degree	Employed	on	Liberal	Atheist	user_115	2019-11-30 15:08:29.873739
first_batch_523	SEEKER	user_745	accept_rating_good	i havent seen it and the guy talked good about it 	18 - 24	Male	Caucasian	High School/GED	University Student	Never been married	Conservative	Protestant	user_744	2019-11-30 15:30:38.025409
first_batch_524	SEEKER	user_747	accept_rating_good	I watched the first anabelle and I wasn't fully aware there was another one. As for the Fallen Angel movie, I like action adventure movies so I would like to at least watch it and see if it lives up to the hype. 	25 - 34	Male	African	High School/GED	Employed	Never been married	Moderate	Other	user_746	2019-11-30 15:51:44.827631
first_batch_525	SEEKER	user_749	accept_others	it was a family comedy that my family wanted to watch	18 - 24	Male	Caucasian	Associate Degree	Employed	Living with partner	Liberal	Atheist	user_748	2019-11-30 16:13:16.799515
first_batch_526	SEEKER	user_751	accept_rating_good	They offered a suggestion that tied into the movie i had enjoyed already this year.	35 - 44	Male	Caucasian	Associate Degree	Employed	Never been married	Liberal	Other	user_750	2019-11-30 16:25:21.408358
first_batch_527	SEEKER	user_752	accept_rating_good	He described good actors and a director I like, plus the original was a great one	35 - 44	Female	Caucasian	Bachelor/4-year Degree	Employed	Never been married	Moderate	Other	user_36	2019-11-30 16:39:07.585673
first_batch_528	SEEKER	user_172	accept_others	It is within a genre I really enjoy with a great cast. 	35 - 44	Female	Caucasian	Associate Degree	Employed	Living with partner	Liberal	Other	user_753	2019-11-30 16:51:01.140863
first_batch_529	SEEKER	user_754	accept_others	Split and shutter island	18 - 24	Female	Hispanic/Latino	Associate Degree	University Student	Living with partner	Liberal	Roman Catholic	user_76	2019-11-30 17:23:26.235824
first_batch_530	SEEKER	user_755	accept_rating_good	I like vampire movies.	35 - 44	Male	Caucasian	Associate Degree	Unable to Work	Divorced	Moderate	Mormon	user_36	2019-11-30 17:36:18.273752
first_batch_531	SEEKER	user_757	accept_others	He seemed knowledgeable and tried to understand my likes/dislikes first	25 - 34	Male	Caucasian	on	Employed	Living with partner	Liberal	Atheist	user_756	2019-11-30 18:39:14.088459
first_batch_535	SEEKER	user_759	accept_rating_good	It looks extremely funny and it looks like it has a great cast. 	Disagree	25 - 34	Male	Hispanic/Latino	Bachelor/4-year Degree	Homemaker	on	Moderate	user_758	2019-11-30 19:14:44.247414
first_batch_532	SEEKER	user_309	accept_others	It looks like an interesting movie	18 - 24	Female	African	High School/GED	Employed	Never been married	Liberal	Atheist	user_760	2019-11-30 18:59:11.143600
first_batch_534	SEEKER	user_762	accept_rating_good	It has two great comedy artists that i really enjoy. 	25 - 34	Female	Caucasian	High School/GED	Employed	on	Liberal	Atheist	user_761	2019-11-30 19:14:41.823540
first_batch_533	SEEKER	user_764	accept_rating_good	I really wanted to see the Joker movie	25 - 34	Male	Caucasian	High School/GED	Employed	Married	Conservative	Muslim	user_763	2019-11-30 19:14:10.174134
first_batch_536	SEEKER	user_75	accept_uninterested	The fact that it's a comedy. 	18 - 24	Female	Caucasian	High School/GED	Employed	Never been married	Moderate	Other	user_742	2019-11-30 19:17:17.683788
first_batch_537	SEEKER	user_26	accept_others	"{  ""vct"": ""0.000"",  ""vd"": ""NaN"",  ""vpl"": """",  ""vbu"": """",  ""vpa"": ""1"",  ""vsk"": ""0"",  ""ven"": ""0"",  ""vpr"": ""1"",  ""vrs"": ""0"",  ""vns"": ""0"",  ""vec"": ""null"",  ""vvol"": ""1"",  ""creationTime"": 8157,  ""totalVideoFrames"": 0,  ""droppedVideoFrames"": 0,  ""corruptedVideoFrames"": 0,  ""state"": ""80"",  ""debug_error"": {    ""errorCode"": ""api.invalidparam"",    ""errorMessage"": ""An error occurred. Please try again later."",    ""pp"": ""GENERIC_WITHOUT_LINK"",    ""Xg"": """",    ""Lz"": ""invalidVideodata.1""  },  ""relative_loudness"": ""NaN"",  ""user_qual"": ""auto"",  ""0sz"": false,  ""op"": """",  ""yof"": false,  ""dis"": """",  ""gpu"": ""ANGLE_(Radeon_RX_Vega_Direct3D11_vs_5_0_ps_5_0)"",  ""cgr"": true,  ""debug_playbackQuality"": ""unknown"",  ""debug_date"": ""Sat Nov 30 2019 22:28:37 GMT-0500 (Eastern Standard Time)""}"	18 - 24	Male	Caucasian	Bachelor/4-year Degree	University Student	Never been married	Moderate	Other	user_765	2019-11-30 19:32:24.949111
first_batch_538	SEEKER	user_767	accept_rating_good	It followed my interests. I like murder mysteries and a good cast	18 - 24	Female	Caucasian	Bachelor/4-year Degree	University Student	Never been married	Liberal	Atheist	user_766	2019-11-30 19:38:45.884719
first_batch_539	SEEKER	user_768	accept_uninterested	if i like the actors in it	25 - 34	Male	Caucasian	Bachelor/4-year Degree	Employed	Never been married	Moderate	Atheist	user_304	2019-11-30 19:39:42.805167
first_batch_540	SEEKER	user_770	accept_others	Conversationalist seemed to know my tastes	25 - 34	Female	Caucasian	High School/GED	Unable to Work	Never been married	Liberal	Other	user_769	2019-11-30 20:00:10.045490
first_batch_541	SEEKER	user_772	accept_rating_good	The like futuristic movies and I like Lost in space.	45 - 54	Male	Caucasian	Bachelor/4-year Degree	Employed	Married	Liberal	Protestant	user_771	2019-11-30 20:23:00.445276
first_batch_543	SEEKER	user_774	accept_rating_good	Because I want to see this movie now!  The action sequences look amazing!  	45 - 54	Female	Caucasian	High School/GED	Employed	Divorced	Liberal	Protestant	user_773	2019-11-30 21:43:37.058829
first_batch_545	SEEKER	user_776	accept_others	It is a funny age-swap movie 	18 - 24	Female	African	High School/GED	University Student	Never been married	Moderate	Protestant	user_775	2019-11-30 21:51:41.084397
first_batch_546	SEEKER	user_778	accept_others	It is an average rated horror movie.	25 - 34	Female	Caucasian	Associate Degree	Employed	Never been married	Conservative	Atheist	user_777	2019-11-30 21:56:13.041523
first_batch_547	SEEKER	user_780	accept_others	The Main Character	18 - 24	Male	Caucasian	Bachelor/4-year Degree	Employed	Never been married	Conservative	Other	user_779	2019-11-30 22:11:10.051240
first_batch_548	SEEKER	user_782	accept_rating_good	good recommend	18 - 24	Female	Caucasian	Associate Degree	Employed	Married	Liberal	Roman Catholic	user_781	2019-11-30 23:05:58.567910
first_batch_549	SEEKER	user_783	accept_others	I've actually seen it advertised before and never got a chance to watch it. It seems funny.	18 - 24	Female	Caucasian	Bachelor/4-year Degree	Employed	Never been married	Liberal	Atheist	user_276	2019-11-30 23:10:47.932441
first_batch_550	SEEKER	user_785	accept_rating_mod	I like Kate Hudson. 	45 - 54	Female	Caucasian	Bachelor/4-year Degree	Employed	Married	Liberal	Other	user_784	2019-11-30 23:59:02.091840
first_batch_551	SEEKER	user_786	accept_uninterested	I loved the first movie.	25 - 34	Male	Caucasian	Associate Degree	Unable to Work	Never been married	Liberal	Buddhist	user_203	2019-12-01 01:04:47.518626
first_batch_552	SEEKER	user_788	accept_others	It looks like a feel good movie that will make me laugh. 	25 - 34	Female	Hispanic/Latino	Vocational Training	Employed	Never been married	Moderate	Roman Catholic	user_787	2019-12-01 01:28:14.219280
first_batch_553	SEEKER	user_555	accept_rating_good	I like that is a recently released movies. I like the Jokers crazy laugh and personality. I like its not a horror movie but it is pretty creepy seeming.	25 - 34	Female	Caucasian	High School/GED	Employed	Living with partner	Moderate	Protestant	user_789	2019-12-01 04:57:53.715811
first_batch_555	SEEKER	user_791	accept_rating_good	the multiverse theme was cool.	35 - 44	Male	Hispanic/Latino	Associate Degree	Employed	Divorced	Conservative	Other	user_790	2019-12-01 06:20:44.235679
first_batch_556	SEEKER	user_793	accept_others	It was one that I have never seen before, so it sounded right in my wheelhouse. 	25 - 34	Male	Caucasian	High School/GED	Employed	Living with partner	Liberal	Atheist	user_792	2019-12-01 06:52:25.544121
first_batch_557	SEEKER	user_795	accept_rating_good	irishman	18 - 24	Male	Caucasian	Bachelor/4-year Degree	Employed	Living with partner	Liberal	Other	user_794	2019-12-01 07:03:11.181286
first_batch_558	SEEKER	user_797	accept_rating_good	It's in the genres I specified and looks like a great movie.	35 - 44	Male	Caucasian	on	Employed	Married	Conservative	Protestant	user_796	2019-12-01 07:22:49.852384
first_batch_559	SEEKER	user_799	accept_rating_good	It's a superhero movie I haven't seen yet. 	25 - 34	Female	Caucasian	on	Employed	Married	Liberal	Jewish	user_798	2019-12-01 07:25:15.971693
first_batch_560	SEEKER	user_801	accept_rating_good	It has a lot of elements I want to see. Nice animation, some action, some adventure and some comedy. I get to see some new Disney films which I have not seen over the past few years. Plus, it is something lighter to watch after the last movie that I saw.	25 - 34	Male	Caucasian	Bachelor/4-year Degree	Employed	Never been married	Liberal	Atheist	user_800	2019-12-01 07:34:24.377557
first_batch_561	SEEKER	user_802	reject		35 - 44	Male	Caucasian	Doctorate	Employed	Married	Moderate	Atheist	user_285	2019-12-01 07:45:24.123327
first_batch_562	SEEKER	user_49	accept_rating_good	I was looking for a film women might like, and she said she liked it. 	45 - 54	Male	South Asian	Bachelor/4-year Degree	Employed	Living with partner	Moderate	Atheist	user_803	2019-12-01 07:51:51.029440
first_batch_563	SEEKER	user_800	accept_rating_good	The recommender told me that it would be good for the boys after also telling me John Cena is in it.	45 - 54	Female	Caucasian	Bachelor/4-year Degree	Homemaker	Married	Moderate	Protestant	user_66	2019-12-01 08:29:56.857681
first_batch_564	SEEKER	user_805	accept_others	The need for another data rumor on the next sequel.	35 - 44	Male	African	Associate Degree	Employed	on	Conservative	Buddhist	user_804	2019-12-01 09:00:49.847191
first_batch_565	SEEKER	user_807	accept_rating_good	The movies seems really interesting	25 - 34	Male	African	on	Employed	Never been married	Moderate	Muslim	user_806	2019-12-01 09:21:19.741408
first_batch_566	SEEKER	user_809	accept_rating_good	This was a great recommendation. I love comedies as well as mysteries and this marries both very nicely. Plus, you can't go wrong with anything with Will Ferrell. 	25 - 34	Male	Caucasian	on	Employed	Married	Liberal	Other	user_808	2019-12-01 09:24:20.867884
first_batch_567	SEEKER	user_810	accept_rating_good	I like Robert DeNiro as an actor and generally enjoy Martin Scorcese movies. 	35 - 44	Male	Caucasian	on	Employed	Never been married	Moderate	Other	user_294	2019-12-01 09:59:46.418837
first_batch_568	SEEKER	user_811	accept_rating_good	because it is the genre i like	25 - 34	Male	East Asian	Bachelor/4-year Degree	Employed	Never been married	Liberal	Atheist	user_8	2019-11-30 00:16:26.085504
first_batch_570	SEEKER	user_813	accept_rating_good	Literally, the word Dragon. The art style is amazing, and the Ed Sheeran song certainly helped. It also was a movie I had been wanting to watch the  movie regardless, to finish off the series. 	18 - 24	Female	Caucasian	High School/GED	University Student	Never been married	Liberal	Other	user_812	2019-11-30 01:07:06.845566
first_batch_571	SEEKER	user_814	accept_rating_good	I like Science Fiction movies and havent seen this one yet.	35 - 44	Female	Caucasian	Associate Degree	Employed	Married	Moderate	Protestant	user_85	2019-11-30 01:12:49.205460
first_batch_572	SEEKER	user_815	accept_rating_mod	I like science fiction, so if it is good, I might give it a chance.	18 - 24	Female	East Asian	Bachelor/4-year Degree	Employed	Never been married	Liberal	Atheist	user_555	2019-11-30 02:04:18.750262
first_batch_573	SEEKER	user_595	accept_others	i love the characters of the movie 	35 - 44	Male	South Asian	Bachelor/4-year Degree	Employed	Married	Conservative	Roman Catholic	user_816	2019-11-30 02:59:17.181614
first_batch_574	SEEKER	user_817	accept_rating_good	Regression sounds like a great movie to watch	35 - 44	Female	African	No Degree	Employed	Never been married	Conservative	Other	user_816	2019-11-30 03:52:34.716729
first_batch_577	SEEKER	user_819	accept_rating_good	I love seeing women who can take care of themselves. Women are always portrayed as weak and vulnerable. These women know they can make it without their husbands.	25 - 34	Female	Caucasian	High School/GED	Homemaker	Married	Moderate	Other	user_818	2019-11-30 06:11:04.854410
first_batch_579	SEEKER	user_821	accept_rating_good	I like horror and the recommendation is trustworthy.	55 - 74	Male	Caucasian	High School/GED	Employed	Divorced	Conservative	Other	user_820	2019-11-30 06:19:34.300233
first_batch_578	SEEKER	user_823	reject		35 - 44	Female	Caucasian	High School/GED	Employed	Divorced	Moderate	Protestant	user_822	2019-11-30 06:18:10.433896
first_batch_580	SEEKER	user_820	accept_others	It is a good action movie with some humor 	18 - 24	Female	Caucasian	High School/GED	University Student	Never been married	Moderate	Roman Catholic	user_717	2019-11-30 06:29:28.925398
first_batch_581	SEEKER	user_824	accept_rating_good	Will Smith	25 - 34	Female	African	Bachelor/4-year Degree	Employed	Never been married	Liberal	Protestant	user_149	2019-11-30 06:50:01.200190
first_batch_582	SEEKER	user_825	accept_others	Scary	35 - 44	Female	Caucasian	No Degree	Employed	Married	Conservative	Protestant	user_401	2019-11-30 07:05:45.342782
first_batch_583	SEEKER	user_827	accept_others	Hadn't heard of the movies and they seem like what I am interested in.	25 - 34	Male	Caucasian	on	Employed	Married	Liberal	Other	user_826	2019-11-30 07:14:51.889365
first_batch_584	SEEKER	user_77	accept_rating_good	Sylvester Stalonne does a very good job in this movie. The plot seems to be very good.	45 - 54	Male	Caucasian	Bachelor/4-year Degree	Employed	Never been married	Moderate	Orthodox	user_828	2019-11-30 07:36:53.048712
first_batch_587	SEEKER	user_221	accept_rating_good	I love Captain Marvel	55 - 74	Female	Caucasian	Professional Postgraduate Degree (Medical, Law, etc)	Retired	Married	Moderate	Protestant	user_829	2019-11-30 07:56:21.252402
first_batch_589	SEEKER	user_830	accept_rating_good	Mostly I really enjoy sci fi movies so the movie seems like it will be my kind of movie. 	35 - 44	Female	Caucasian	Bachelor/4-year Degree	Retired	Married	Liberal	Other	user_36	2019-11-30 08:01:19.857167
first_batch_590	SEEKER	user_832	accept_rating_good	It seems to be full of action and adventure, as well as suspense. I like that the movie is from the 80's, it has a nice classic feel to it. Also, BRUCE WILLIS! 	25 - 34	Female	Caucasian	Vocational Training	Employed	Never been married	Moderate	Other	user_831	2019-11-30 08:17:27.913204
first_batch_592	SEEKER	user_834	accept_uninterested	It sounded like the type of movie that I really wanted to see!	45 - 54	Male	Caucasian	High School/GED	Employed	Married	Moderate	Protestant	user_833	2019-11-30 08:31:10.863632
first_batch_593	SEEKER	user_835	accept_others	I like watching movie trailers	35 - 44	Female	Caucasian	Bachelor/4-year Degree	Employed	Married	Liberal	Protestant	user_8	2019-11-30 08:50:32.504970
first_batch_594	SEEKER	user_837	accept_rating_good	That it is something that I can watch if kids are around.	45 - 54	Female	Caucasian	Vocational Training	Employed	Married	Moderate	Protestant	user_836	2019-11-30 09:04:06.010587
first_batch_595	SEEKER	user_839	accept_rating_good	I've seen the original, and they recommended the remake!	25 - 34	Male	Caucasian	on	Employed	Never been married	Moderate	Other	user_838	2019-11-30 09:04:44.577870
first_batch_597	SEEKER	user_841	accept_rating_good	I like the mystery surrounding it and the plot looks good. 	35 - 44	Female	Caucasian	Bachelor/4-year Degree	Employed	Married	Liberal	Other	user_840	2019-11-30 09:14:12.716356
first_batch_600	SEEKER	user_842	accept_rating_good	It is family based.	12 or younger	Female	Hispanic/Latino	on	Employed	Married	Moderate	Protestant	user_804	2019-11-30 09:42:17.939182
first_batch_601	SEEKER	user_31	accept_rating_good	I love psychological thrillers	18 - 24	Female	Caucasian	Bachelor/4-year Degree	Employed	Never been married	Liberal	Other	user_756	2019-11-30 09:59:44.707912
first_batch_602	SEEKER	user_304	accept_rating_good	this is the kind of movie that I like to watch. It has the action and crime scenes I enjoy seeing.	55 - 74	Female	Caucasian	Associate Degree	Employed	Married	Conservative	Roman Catholic	user_364	2019-11-30 10:37:59.659988
first_batch_603	SEEKER	user_31	accept_uninterested	I have never heard of the film	18 - 24	Female	Caucasian	Bachelor/4-year Degree	Employed	Never been married	Liberal	Other	user_8	2019-11-30 10:46:36.355944
first_batch_604	SEEKER	user_331	accept_others	I love a good thriller and especially a psychological one and this seems to have all of that.	35 - 44	Female	Caucasian	Vocational Training	Employed	Married	Conservative	Protestant	user_695	2019-11-30 10:53:21.849181
first_batch_606	SEEKER	user_843	accept_rating_good	i love these movies. 	35 - 44	Male	Other	Associate Degree	Employed	Living with partner	Liberal	Atheist	user_805	2019-11-30 11:06:18.272906
first_batch_605	SEEKER	user_844	accept_rating_good	It is similar to movies I have watched in the past and has the same cast members.	18 - 24	Male	Caucasian	Bachelor/4-year Degree	Employed	Never been married	Conservative	Roman Catholic	user_833	2019-11-30 11:05:41.821780
first_batch_607	SEEKER	user_846	accept_others	I liked it!	18 - 24	Female	Hispanic/Latino	High School/GED	University Student	Never been married	Moderate	Other	user_845	2019-11-30 11:11:23.227231
first_batch_608	SEEKER	user_77	accept_rating_good	I have seen previous movies of the series and I liked all of them.	45 - 54	Male	Caucasian	Bachelor/4-year Degree	Employed	Never been married	Moderate	Orthodox	user_847	2019-11-30 11:14:48.462283
first_batch_609	SEEKER	user_848	accept_rating_good	I like thrillers.	25 - 34	Female	Caucasian	High School/GED	Employed	Living with partner	Liberal	Atheist	user_8	2019-11-30 11:16:54.588411
first_batch_610	SEEKER	user_850	accept_others	To watch new things	18 - 24	Female	Hispanic/Latino	High School/GED	University Student	Never been married	Liberal	Roman Catholic	user_849	2019-11-30 11:21:33.159786
first_batch_612	SEEKER	user_851	accept_rating_good	I was attracted to accept the recommended video because Bob Thornton is one of my favorite actors.	35 - 44	Female	African	High School/GED	Employed	Never been married	Conservative	Protestant	user_386	2019-11-30 11:30:42.753671
first_batch_613	SEEKER	user_853	accept_rating_mod	I havent seen it yet and its been on my list anyway	25 - 34	Female	African	High School/GED	Unable to Work	Never been married	Liberal	Other	user_852	2019-11-30 11:31:34.766596
